[
  {
    "id": "cn-mindray",
    "name": {
      "en": "Mindray Medical (Shenzhen Mindray Bio-Medical Electronics)",
      "local": "深圳迈瑞生物医疗电子股份有限公司"
    },
    "aka": [
      "Mindray",
      "迈瑞医疗",
      "SZSE:300760",
      "NYSE:MR (delisted 2016)"
    ],
    "category": "medtech-devices",
    "sectors": [
      "diagnostics",
      "medical-imaging"
    ],
    "status": "public",
    "founded_year": 1991,
    "region": "greater-china",
    "country": "China",
    "hq_city": "Shenzhen",
    "website": "https://www.mindray.com",
    "profile": {
      "what": {
        "en": "Makes patient monitoring & life-support equipment (monitors, ventilators, anesthesia systems, defibrillators), in-vitro diagnostic analyzers/reagents, and medical imaging systems.",
        "zh": "生產病患監測與生命支援設備(監護儀、呼吸器、麻醉機、除顫器)、體外診斷分析儀與試劑,以及醫學影像系統。"
      },
      "modalities": [
        "medical-hardware"
      ],
      "development_stage": "commercial",
      "team_size": null
    },
    "people": [
      {
        "name": "Li Xiting",
        "role": "co-founder"
      },
      {
        "name": "Xu Hang",
        "role": "co-founder"
      },
      {
        "name": "Cheng Minghe",
        "role": "co-founder"
      }
    ],
    "summary": {
      "en": "One of China's largest medical device makers, spanning patient monitoring, in-vitro diagnostics and medical imaging; listed on the Shenzhen Stock Exchange after relisting from a 2016 NYSE delisting."
    },
    "sources": [
      {
        "url": "https://en.wikipedia.org/wiki/Mindray",
        "title": "Mindray",
        "publisher": "Wikipedia",
        "accessed": "2026-08-16",
        "supports": "founding year, HQ, listing history, product lines, 2024 revenue",
        "quote": "founded in 1991 in Shenzhen, Guangdong by seven former employees of Anke"
      }
    ],
    "confidence": "medium",
    "last_updated": "2026-08-16",
    "researched_by": "r6-china-medtech"
  },
  {
    "id": "cn-bgi-genomics",
    "name": {
      "en": "BGI Genomics",
      "local": "华大基因"
    },
    "aka": [
      "BGI Group",
      "Beijing Genomics Institute",
      "SZSE:300676"
    ],
    "category": "genomics-omics",
    "sectors": [
      "diagnostics",
      "life-science-tools"
    ],
    "status": "public",
    "founded_year": 1999,
    "region": "greater-china",
    "country": "China",
    "hq_city": "Shenzhen",
    "website": "https://www.bgi.com",
    "profile": {
      "what": {
        "en": "Genome sequencing group offering next-generation sequencing platforms, prenatal/genetic diagnostic tests (incl. NIFTY NIPT), and infectious-disease testing kits.",
        "zh": "基因體定序集團,提供次世代定序平台、產前與遺傳診斷檢測(含 NIFTY 非侵入性產前檢測),以及感染症檢驗試劑。"
      },
      "modalities": [
        "lab-automation"
      ],
      "indications": [
        "rare-disease",
        "womens-health",
        "infectious-disease"
      ],
      "development_stage": "commercial",
      "regulatory": [
        {
          "body": "WHO",
          "kind": "emergency-use-listing",
          "item": "RT-PCR COVID-19 test",
          "year": null
        },
        {
          "body": "CFDA (now NMPA)",
          "kind": "approval",
          "item": "NIFTY prenatal test (BGISEQ platform)",
          "year": null
        }
      ]
    },
    "funding": {
      "investors": [
        {
          "name": "China Life Insurance Company",
          "entity_id": null,
          "role": "participant"
        },
        {
          "name": "CITIC Group's Goldstone Investment",
          "entity_id": null,
          "role": "participant"
        },
        {
          "name": "Yunfeng Capital",
          "entity_id": null,
          "role": "participant"
        },
        {
          "name": "SoftBank China Capital",
          "entity_id": null,
          "role": "participant"
        },
        {
          "name": "State Development and Investment Corporation",
          "entity_id": null,
          "role": "participant",
          "round": "2021"
        },
        {
          "name": "China Merchants Group",
          "entity_id": null,
          "role": "participant",
          "round": "2021"
        }
      ]
    },
    "summary": {
      "en": "Shenzhen-based genomics group; its BGI Genomics subsidiary (SZSE:300676) sells NGS sequencing platforms and diagnostic tests including NIPT and infectious-disease kits."
    },
    "sources": [
      {
        "url": "https://en.wikipedia.org/wiki/BGI_Group",
        "title": "BGI Group",
        "publisher": "Wikipedia",
        "accessed": "2026-08-16",
        "supports": "founding, HQ, WHO EUL, investors, 2016 revenue",
        "quote": "China Life Insurance Company, CITIC Group's Goldstone Investment, Jack Ma's Yunfeng Capital, and SoftBank China Capital"
      }
    ],
    "confidence": "medium",
    "last_updated": "2026-08-16",
    "researched_by": "r6-china-medtech"
  },
  {
    "id": "cn-venus-medtech",
    "name": {
      "en": "Venus Medtech",
      "local": "启明医疗"
    },
    "aka": [
      "Hangzhou Venus Medtech",
      "HKEX:2500"
    ],
    "category": "medtech-devices",
    "sectors": [],
    "status": "public",
    "founded_year": 2009,
    "region": "greater-china",
    "country": "China",
    "hq_city": "Hangzhou",
    "website": "https://www.venusmedtech.com",
    "profile": {
      "what": {
        "en": "Makes transcatheter heart valve devices (TAVR/TAVI and related surgical accessories) for aortic, pulmonary, mitral and tricuspid valve disease.",
        "zh": "生產經導管心臟瓣膜器材(TAVR/TAVI 及相關手術配件),用於主動脈瓣、肺動脈瓣、二尖瓣與三尖瓣疾病。"
      },
      "modalities": [
        "medical-hardware"
      ],
      "indications": [
        "cardiovascular"
      ],
      "development_stage": "commercial"
    },
    "summary": {
      "en": "Hangzhou-based transcatheter heart valve maker, listed on HKEX (2500.HK) since December 2019; products sold in 60+ countries with 60,000+ real-world implants reported."
    },
    "sources": [
      {
        "url": "https://www.venusmedtech.com/",
        "title": "Venus Medtech - Official site",
        "publisher": "Venus Medtech",
        "accessed": "2026-08-16",
        "supports": "founding, HQ, listing, products",
        "quote": "aortic, pulmonary, mitral, and tricuspid valve diseases"
      }
    ],
    "confidence": "high",
    "last_updated": "2026-08-16",
    "researched_by": "r6-china-medtech"
  },
  {
    "id": "cn-lepu-medical",
    "name": {
      "en": "Lepu Medical Technology",
      "local": "乐普医疗"
    },
    "aka": [
      "Lepu (Beijing) Medical Devices Co., Ltd.",
      "SZSE:300003"
    ],
    "category": "medtech-devices",
    "sectors": [
      "diagnostics"
    ],
    "status": "public",
    "founded_year": 1999,
    "region": "greater-china",
    "country": "China",
    "hq_city": "Beijing",
    "website": "https://www.lepumedical.com",
    "profile": {
      "what": {
        "en": "Coronary-artery interventional device maker (heart stents and related cardiovascular disease management products); later expanded into pharmaceuticals.",
        "zh": "冠狀動脈介入器材製造商(心臟支架與相關心血管疾病管理產品),後來跨足製藥。"
      },
      "modalities": [
        "medical-hardware"
      ],
      "indications": [
        "cardiovascular"
      ],
      "development_stage": "commercial"
    },
    "funding": {
      "investors": [
        {
          "name": "725th Research Institute of China State Shipbuilding Industry Corporation",
          "entity_id": null,
          "role": "participant",
          "round": "founding-1999"
        },
        {
          "name": "WP Medical Technology Company (US)",
          "entity_id": null,
          "role": "participant",
          "round": "founding-1999"
        }
      ]
    },
    "summary": {
      "en": "Beijing cardiovascular device maker (coronary stents) founded jointly by a CSSC research institute and a US medical-technology partner; listed on the Shenzhen ChiNext board in 2009."
    },
    "sources": [
      {
        "url": "https://zh.wikipedia.org/wiki/乐普医疗",
        "title": "乐普医疗",
        "publisher": "Wikipedia (zh)",
        "accessed": "2026-08-16",
        "supports": "founding investors, HQ, listing, products",
        "quote": "北京籌備成立時系由中國船舶重工集團公司第七二五研究所和美國WP醫療科技公司共同出資組建"
      }
    ],
    "confidence": "medium",
    "last_updated": "2026-08-16",
    "researched_by": "r6-china-medtech"
  },
  {
    "id": "cn-united-imaging-healthcare",
    "name": {
      "en": "United Imaging Healthcare",
      "local": "上海联影医疗科技股份有限公司"
    },
    "aka": [
      "UIH",
      "联影医疗",
      "SSE:688271"
    ],
    "category": "medical-imaging",
    "sectors": [
      "medtech-devices"
    ],
    "status": "public",
    "founded_year": 2011,
    "region": "greater-china",
    "country": "China",
    "hq_city": "Shanghai",
    "website": "https://www.united-imaging.com",
    "profile": {
      "what": {
        "en": "Manufactures medical imaging and radiotherapy equipment: CT, MRI, PET and X-ray systems.",
        "zh": "生產醫學影像與放射治療設備:CT、MRI、PET 與 X 光系統。"
      },
      "modalities": [
        "medical-hardware"
      ],
      "development_stage": "commercial",
      "regulatory": [
        {
          "body": "Health Canada",
          "kind": "approval",
          "item": "imaging equipment (first Health Canada approvals)",
          "year": 2024
        }
      ]
    },
    "summary": {
      "en": "Shanghai-founded imaging-hardware maker (CT/MRI/PET/X-ray), founded by former Siemens employees; listed on the Shanghai STAR Market (688271.SH), raising roughly US$1.6 billion in its August 2022 IPO."
    },
    "sources": [
      {
        "url": "https://en.wikipedia.org/wiki/United_Imaging",
        "title": "United Imaging",
        "publisher": "Wikipedia",
        "accessed": "2026-08-16",
        "supports": "founding, HQ, listing, products, IPO size, revenue",
        "quote": "medical imaging and radiotherapy equipment"
      }
    ],
    "confidence": "medium",
    "last_updated": "2026-08-16",